{
  "document_type": "long_doc",
  "locale": "zh-CN",
  "meta": {
    "title": "Momo Paper 使用指南",
    "subtitle": "推荐通过 Skill 方式使用——AI agent 自动处理安装和渲染。也支持手动 CLI 和直接 HTML 模板两种替代工作流。",
    "eyebrow": "Momo Paper / 使用指南",
    "date": "2026-05-02",
    "author": "Momo Paper"
  },
  "sections": {
    "abstract": {
      "body": [
        "使用 Momo Paper 最简单的方式是通过 Claude Code Skill——AI agent 自动完成从安装到渲染的全部步骤，你只需要说出想要什么文档。",
        "如果你偏好手动操作，也可以直接使用 CLI 命令或编辑 HTML 模板。三种方式共享同一套设计令牌，输出效果完全一致。"
      ],
      "findings": [
        "推荐方式：Skill（AI agent 全自动处理安装和渲染）",
        "备选方式：CLI 手动（momo init → momo render）",
        "快速方式：直接 HTML 模板（打开文件 → 编辑内容 → 浏览器预览）",
        "5 种可编程图表，嵌入 JSON 的 chart 对象即可"
      ]
    },
    "sections": [
      {
        "heading": "推荐方式：通过 Skill 使用",
        "body": [
          "Momo Paper 提供了 Claude Code Skill（SKILL.md），这是最推荐的使用方式。你不需要手动安装任何东西——当你告诉 AI agent 你想要创建什么文档时，Skill 会自动触发。",
          "Skill 会自动处理：检查并安装 momo CLI → 选择合适的文档类型 → 生成 JSON 骨架 → 引导你填充内容 → 渲染 HTML。整个过程你只需要描述需求、确认内容即可。"
        ],
        "code_blocks": [
          {
            "language": "text",
            "content": "# 你只需要这样说：\n\"帮我生成一份 Q2 产品增长方案\"\n\"帮我做一份简历\"\n\"把这个数据分析渲染成报告\"\n\n# Skill 会自动：\n# 1. 检测并安装 momo CLI（如未安装）\n# 2. 选择合适的文档类型\n# 3. 生成 JSON 数据\n# 4. 渲染为 HTML 文档\n# 5. 打开浏览器预览"
          }
        ]
      },
      {
        "heading": "手动安装 CLI",
        "body": [
          "如果你需要直接使用 CLI 命令（而非通过 Skill），可以手动安装引擎。前提条件：Python 3.10+。"
        ],
        "code_blocks": [
          {
            "language": "bash",
            "content": "# 1. 创建并激活虚拟环境\npython3 -m venv .venv\nsource .venv/bin/activate\n\n# 2. 进入引擎目录\ncd scripts/json-engine\n\n# 3. 可编辑安装\npip install -e .\n\n# 4. （可选）安装开发依赖，运行测试\npip install -e \".[dev]\"\n\n# 验证安装\nmomo list"
          }
        ]
      },
      {
        "heading": "CLI 命令参考",
        "body": [
          "安装完成后，你会获得两个等价的 CLI 入口点：momo 和 momo-paper（它们指向同一个命令）。"
        ],
        "code_blocks": [
          {
            "language": "bash",
            "content": "# 列出全部 15 种支持的文档类型\nmomo list\n\n# 为指定类型生成 JSON 骨架\nmomo init -t one_pager -o my-doc.json     # 中文\nmomo init -t one_pager -l en -o my-doc.json  # 英文\n\n# 将 JSON 数据渲染为 HTML\nmomo render -d my-doc.json -o output.html\n\n# 从 stdin 读取 JSON 并渲染\ncat my-doc.json | momo render -d - -o output.html\n\n# 从 JSON 中提取图表，渲染为独立 SVG\nmomo chart -d my-report.json -k sections.trends.chart -o chart.svg\n\n# 批量渲染全部示例\npython render_all.py"
          }
        ]
      },
      {
        "heading": "JSON 数据格式",
        "body": [
          "每个文档共享相同的顶层结构（slides 类型用 slides 替代 sections）。",
          "document_type：15 种类型之一，决定使用哪个 Jinja2 模板渲染。",
          "locale：zh-CN 或 en，自动切换 section 标题语言。",
          "meta：title、subtitle 和可选的 eyebrow、date、author。",
          "sections：文档类型特定的内容，由 JSON Schema 定义字段和校验规则。",
          "每种文档类型的 sections 结构不同。例如 one_pager 有固定的 summary/context/evidence/recommendation 四段，而 long_doc 有可迭代的 sections 数组，每项含 heading 和 body。使用 momo init 生成骨架可以快速了解各类型的字段结构。"
        ],
        "code_blocks": [
          {
            "language": "json",
            "content": "{\n  \"document_type\": \"one_pager\",\n  \"locale\": \"zh-CN\",\n  \"meta\": {\n    \"title\": \"Q2 增长方案\",\n    \"subtitle\": \"聚焦留存与激活\",\n    \"eyebrow\": \"产品团队 / 2026 Q2\",\n    \"date\": \"2026-04-01\",\n    \"author\": \"产品团队\"\n  },\n  \"sections\": {\n    \"summary\": {\n      \"body\": [\"本方案的核心目标是……\"],\n      \"points\": [\"DAU +18%\", \"留存 +8pp\"]\n    },\n    \"context\": {\n      \"body\": [\"过去两个季度……\"]\n    },\n    \"evidence\": {\n      \"body\": [\"数据来自 Q1 分析报告\"],\n      \"cards\": [\n        {\"label\": \"DAU\", \"value\": \"102 万\"}\n      ]\n    },\n    \"recommendation\": {\n      \"body\": [\"建议 Q2 集中资源……\"],\n      \"actions\": [\"Phase 1: 重设计 onboarding\"]\n    }\n  }\n}"
          }
        ]
      },
      {
        "heading": "嵌入图表",
        "body": [
          "在任意 section 内添加 chart 对象，引擎会自动渲染为内联 SVG。支持 5 种图表类型：",
          "bar（柱状图）：适合类别对比，数据格式 values: [n, ...]。",
          "line（折线图）：适合时间序列和趋势，数据格式 values: [n, ...]，配合 labels。",
          "donut（环形图）：适合比例分解，数据格式 values: [n, ...]。",
          "candlestick（K 线图）：适合 OHLC 价格序列，数据格式 values: [{o,h,l,c}, ...]。",
          "waterfall（瀑布图）：适合数值分解和桥接，数据格式 values: [n, ...]。",
          "除了通过 JSON 引擎在文档中嵌入图表，你也可以通过 momo chart 命令将图表渲染为独立 SVG 文件。"
        ]
      },
      {
        "heading": "直接 HTML 模板（替代方式）",
        "body": [
          "如果你不想用 Skill 或 CLI，assets/templates/ 目录下提供了 30 个独立的 HTML 文件（15 种类型 × 2 种语言）。这是零门槛的「直接编辑」模式：",
          "打开模板，替换占位内容为你自己的文字。",
          "无需 CLI、JSON 或构建步骤——只需要 HTML 和 CSS。",
          "设计令牌以 CSS 自定义属性的形式嵌入在每个文件中。",
          "适合需要快速生成一次性文档、或者更偏好直接操作 HTML 的场景。三种方式共享同一套设计令牌、字体系统和视觉语言，输出效果完全一致。"
        ]
      }
    ],
    "conclusion": {
      "body": [
        "无论你选择哪种方式——Skill（AI 自动）、CLI（手动命令）还是 HTML 模板（直接编辑）——输出的文档都共享同一套精心调校的设计语言。选择最适合你工作流的方式，开始创建排版精良的文档。"
      ],
      "next_steps": [
        "直接在 Claude Code 中说「帮我做一份 XX 文档」触发 Skill",
        "运行 momo list 查看所有支持的文档类型",
        "浏览文档类型示例页面，查看每种类型的渲染效果",
        "在图表演示页面体验 5 种可编程图表"
      ]
    }
  }
}
