{
  "document_type": "long_doc",
  "locale": "zh-CN",
  "meta": {
    "title": "云原生架构转型白皮书",
    "subtitle": "从单体应用到微服务与容器化的全面实践指南",
    "eyebrow": "Momo Paper / long_doc / zh-CN",
    "date": "2025-04-28",
    "author": "架构委员会"
  },
  "sections": {
    "abstract": {
      "body": [
        "本文档总结了 Momo Tech 在过去 18 个月中从传统单体架构向云原生架构转型的完整实践。涵盖了微服务拆分策略、容器化部署、CI/CD 流水线重构、以及可观测性体系建设的经验与教训。"
      ],
      "findings": [
        "微服务拆分应遵循业务边界而非技术边界",
        "容器化降低了 40% 的基础设施成本",
        "服务网格简化了跨语言服务通信，但增加了 15% 的运维复杂度"
      ]
    },
    "sections": [
      {
        "heading": "背景与挑战",
        "body": [
          "2023 年初，我们的核心电商平台仍运行在一个 200 万行代码的单体应用中。每次发布需要 4 小时，回滚窗口长达 2 小时。代码冲突频繁，团队之间协调成本极高。",
          "随着业务增长，单体架构已成为创新的瓶颈。新功能上线周期从 2 周延长至 6 周，技术债积累严重。"
        ]
      },
      {
        "heading": "微服务拆分策略",
        "body": [
          "我们采用领域驱动设计（DDD）方法，将单体应用拆分为 12 个核心微服务。每个服务由独立团队负责，拥有自己的数据库和发布节奏。",
          "关键原则：服务边界应与业务边界对齐。例如，订单服务、库存服务、支付服务分别独立，避免跨服务的事务耦合。"
        ],
        "quote": {
          "text": "微服务不是目标，而是手段。目标是让团队能够独立、快速地交付价值。",
          "source": "架构委员会，2023 年 6 月"
        }
      },
      {
        "heading": "容器化与编排",
        "body": [
          "全部服务迁移至 Kubernetes 集群，使用 Helm 管理部署配置。容器镜像构建时间从 15 分钟优化至 3 分钟。",
          "引入了 HPA（水平自动扩缩容）和 VPA（垂直自动扩缩容），在流量高峰期间自动扩展 Pod 数量，资源利用率从 25% 提升至 65%。"
        ]
      }
    ],
    "conclusion": {
      "body": [
        "云原生转型是一项长期投资。18 个月后，我们的发布频率从每周 2 次提升至每天 20 次，故障恢复时间从 2 小时缩短至 15 分钟。"
      ],
      "next_steps": [
        "推进多活架构，实现跨地域容灾",
        "引入 GitOps 管理模式，进一步自动化运维",
        "建立 FinOps 体系，优化云成本"
      ]
    }
  }
}
